{
  "authority": "applied",
  "contentVersion": "progression-rebalance-v1",
  "compatibilityOnly": false,
  "enhancementMaterials": {
    "NORMAL": {
      "M1": [
        40,
        40,
        40,
        40,
        40,
        40,
        40,
        40,
        40,
        40,
        60,
        60,
        60,
        60,
        60,
        60,
        60,
        60,
        60,
        60,
        74,
        74,
        74,
        74,
        74,
        74,
        74,
        74,
        74
      ]
    },
    "RARE": {
      "M1": [
        74,
        74,
        74,
        74,
        74,
        74,
        74,
        74,
        74,
        74,
        111,
        111,
        111,
        111,
        111,
        111,
        111,
        111,
        111,
        111,
        205,
        205,
        205,
        205,
        206,
        206,
        206,
        206,
        206
      ],
      "M2": [
        8,
        8,
        8,
        8,
        8,
        8,
        8,
        8,
        8,
        8,
        12,
        12,
        12,
        12,
        12,
        12,
        12,
        12,
        12,
        12,
        22,
        22,
        22,
        22,
        22,
        22,
        22,
        23,
        23
      ]
    },
    "EPIC": {
      "M1": [
        206,
        206,
        206,
        206,
        206,
        206,
        206,
        206,
        206,
        206,
        309,
        309,
        309,
        309,
        309,
        309,
        309,
        309,
        309,
        309,
        572,
        572,
        572,
        572,
        572,
        572,
        572,
        573,
        573
      ],
      "M2": [
        41,
        41,
        41,
        41,
        41,
        41,
        41,
        41,
        42,
        42,
        61,
        61,
        62,
        62,
        62,
        62,
        62,
        62,
        62,
        62,
        114,
        114,
        114,
        114,
        114,
        115,
        115,
        115,
        115
      ],
      "M3": [
        8,
        8,
        8,
        8,
        8,
        8,
        8,
        8,
        9,
        9,
        12,
        12,
        12,
        12,
        12,
        12,
        13,
        13,
        13,
        13,
        22,
        23,
        23,
        23,
        23,
        23,
        23,
        23,
        23
      ]
    },
    "LEGENDARY": {
      "M1": [
        1250,
        1250,
        1250,
        1250,
        1250,
        1250,
        1250,
        1250,
        1250,
        1250,
        1375,
        1375,
        1375,
        1375,
        1375,
        1375,
        1375,
        1375,
        1375,
        1375,
        1500,
        1500,
        1500,
        1500,
        1500,
        1500,
        1500,
        1500,
        1500
      ],
      "M2": [
        250,
        250,
        250,
        250,
        250,
        250,
        250,
        250,
        250,
        250,
        275,
        275,
        275,
        275,
        275,
        275,
        275,
        275,
        275,
        275,
        300,
        300,
        300,
        300,
        300,
        300,
        300,
        300,
        300
      ],
      "M3": [
        50,
        50,
        50,
        50,
        50,
        50,
        50,
        50,
        50,
        50,
        55,
        55,
        55,
        55,
        55,
        55,
        55,
        55,
        55,
        55,
        60,
        60,
        60,
        60,
        60,
        60,
        60,
        60,
        60
      ],
      "M4": [
        10,
        10,
        10,
        10,
        10,
        10,
        10,
        10,
        10,
        10,
        11,
        11,
        11,
        11,
        11,
        11,
        11,
        11,
        11,
        11,
        12,
        12,
        12,
        12,
        12,
        12,
        12,
        12,
        12
      ]
    }
  },
  "enhancementRice": {
    "NORMAL": [
      30,
      60,
      90,
      120,
      150,
      180,
      210,
      240,
      270,
      300,
      330,
      360,
      390,
      420,
      450,
      480,
      510,
      540,
      570,
      600,
      630,
      660,
      690,
      720,
      750,
      780,
      810,
      840,
      870
    ],
    "RARE": [
      930,
      960,
      990,
      1020,
      1050,
      1080,
      1110,
      1140,
      1170,
      1200,
      1230,
      1260,
      1290,
      1320,
      1350,
      1380,
      1410,
      1440,
      1470,
      1500,
      1530,
      1560,
      1590,
      1620,
      1650,
      1680,
      1710,
      1740,
      1770
    ],
    "EPIC": [
      1830,
      1860,
      1890,
      1920,
      1950,
      1980,
      2010,
      2040,
      2070,
      2100,
      2130,
      2160,
      2190,
      2220,
      2250,
      2280,
      2310,
      2340,
      2370,
      2400,
      2430,
      2460,
      2490,
      2520,
      2550,
      2580,
      2610,
      2640,
      2670
    ],
    "LEGENDARY": [
      2730,
      2760,
      2790,
      2820,
      2850,
      2880,
      2910,
      2940,
      2970,
      3000,
      3030,
      3060,
      3090,
      3120,
      3150,
      3180,
      3210,
      3240,
      3270,
      3300,
      3330,
      3360,
      3390,
      3420,
      3450,
      3480,
      3510,
      3540,
      3570
    ]
  },
  "promotion": {
    "NORMAL": {
      "requiredStageId": "stage.01-10",
      "materials": {
        "M1": 74,
        "M2": 1
      },
      "rice": 870,
      "resultGrade": "RARE"
    },
    "RARE": {
      "requiredStageId": "stage.03-10",
      "materials": {
        "M1": 206,
        "M2": 23,
        "M3": 1
      },
      "rice": 1770,
      "resultGrade": "EPIC"
    },
    "EPIC": {
      "requiredStageId": "stage.05-10",
      "materials": {
        "M1": 573,
        "M2": 115,
        "M3": 23,
        "M4": 1
      },
      "rice": 2670,
      "resultGrade": "LEGENDARY"
    },
    "LEGENDARY": {
      "requiredStageId": "stage.99-99",
      "materials": {},
      "rice": 0,
      "resultGrade": "LEGENDARY"
    }
  }
}
